curie eme inkml json-ld mse rif scxml smil timesheet |CURIE EME InkML JSON-LD MSE RIF SCXML SMIL Timesheets ,3.0911760713432344
omegat free computer assisted translation tools platform cross-platform java |OmegaT Free computer assisted translation tools platform Cross-platform Java ,2.877528943079854
mac os x intel powerpc linux solaris freebsd bsd |Mac OS X Intel PowerPC Linux Solaris FreeBSD BSD ,2.849532539642373
spire xls http www e-iceblue com introduce excel-for-net-introduce html |Spire XLS http www e-iceblue com Introduce excel-for-net-introduce html ,2.808746615013785
windows nextoffice well develop international limited proprietary yes import |Windows NextOffice Well Develop International Limited Proprietary Yes Import ,2.8060727100378604
windows nextoffice well develop international ltd proprietary yes import |Windows NextOffice Well Develop International Ltd Proprietary Yes Import ,2.7915545380701134
mac os x iwork apple inc proprietary yes openoffice |Mac OS X iWork Apple Inc Proprietary Yes OpenOffice ,2.789641905466938
binary xml ebml wbxml category xml category xml-based standard |Binary XML EBML WBXML Category XML Category XML-based standards ,2.7878694194179143
search office open xml office open xml file format |search Office Open XML Office Open XML file formats ,2.7866376964634654
oxygen xml editor german v t e eclipse |Oxygen XML Editor german v t e Eclipse ,2.5630069224715397
xml editors office open xml software licensing edit |XML editors Office Open XML software Licensing edit ,2.5622248212734897
linux ibm lotus symphony ibm proprietary yes import |Linux IBM Lotus Symphony IBM Proprietary Yes Import ,2.486038959622367
tag folding intellisense auto completion using schema xsd |Tag Folding Intellisense Auto completion using schema xsd ,2.479563918048645
en wikipedia org w index php title category |en wikipedia org w index php title Category ,2.4772946559513946
office open xml and zip archive file pair |Office Open XML and ZIP archive file pairs ,2.4693182594266383
linux thinkfree office thinkfree corp proprietary yes version |Linux Thinkfree Office ThinkFree Corp Proprietary Yes Version ,2.467500078220994
b c http infocenters lotus com domino index |b c http infocenters lotus com domino index ,2.4671894436893873
spread standardization project regarding east asian documents project |SPREAD Standardization Project Regarding East Asian Documents project ,2.46688114310608
iso-related china japan korea document processing expert group |ISO-related China Japan Korea Document Processing expert group ,2.4661212078469736
lgpl cddl yes import only ibm lotus symphony |LGPL CDDL Yes Import only IBM Lotus Symphony ,2.4607817151342184
gpl yes limited support butler office pro x |GPL Yes Limited support Butler Office Pro X ,2.4581719112694347
xml |xml |XML ,2.3225663937520244
ibm rational requisitepro linked requirements report plug-in |IBM Rational RequisitePro Linked Requirements Report Plug-in ,2.1735382036804327
office |Office ,2.167792559704253
mac os x go-oo free software community |Mac OS X Go-oo Free software community ,2.166525352166809
solaris staroffice sun microsystems proprietary yes import |Solaris StarOffice Sun Microsystems Proprietary Yes Import ,2.1578289834483555
xls xlsx ods csv html pdf xps |XLS XLSX ODS CSV HTML PDF XPS ,2.1546142990383186
linux eioffice evermore software proprietary yes import |Linux EIOffice Evermore Software Proprietary Yes Import ,2.153563885414464
bibliographic edit refworks web-based commercial citation manager |Bibliographic edit RefWorks Web-based commercial citation manager ,2.149998530274091
www copernic com en products desktop-search features-file-type |www copernic com en products desktop-search features-file-types ,2.1491179384589763
italics category commons internet portal software portal |italics Category Commons Internet portal Software portal ,2.147082249355516
mac os x microsoft office microsoft proprietary |Mac OS X Microsoft Office Microsoft Proprietary ,2.144948800238579
corrupt office suite text data extracting service |Corrupt Office Suite Text Data Extracting Service ,2.140949963558934
character repertoire constraints renaming and entity expansion |character repertoire constraints renaming and entity expansion ,2.130495498436783
markup languages open formats presentation layer protocol |Markup languages Open formats Presentation layer protocols ,2.1299713776357305
modern office suite text data salvaging service |Modern Office Suite Text Data Salvaging Service ,2.129869681122987
b c open xml package explorer release |b c Open XML Package Explorer Release ,2.1278026363224143
n a n a liquid xml studio |N A N A Liquid XML Studio ,2.127439807402518
office open xml software v t e |Office Open XML software v t e ,2.1273081489719496
internet media type application xml text xml |Internet media type application xml text xml ,2.127232840469846
gpl yes standalone yes yes yes no |GPL Yes Standalone Yes Yes Yes No ,2.127119401774532
office open xml software network effect open |Office Open XML software Network effect Open ,2.127028155762952
office open xml word processing file format |Office Open XML word processing file formats ,2.1270011262527686
media types application xml and text xml |media types application xml and text xml ,2.1268833288533777
text spreadsheet and other mac office application |text spreadsheet and other Mac office applications ,1.9855704726590928
specification promise office open xml software comparison |Specification Promise Office Open XML software Comparison ,1.984173358187346
mac os x |Mac OS X ,1.9708811412489222
java-based cross-platform computer assisted translation tool |Java-based cross-platform Computer Assisted Translation tool ,1.9274608502579436
debugging support or schema editing support |debugging support or schema editing support ,1.9030122393622495
full xslt editing and debugging support |full XSLT editing and debugging support ,1.9028171764737807
file |files |file ,1.9025116309740462
waterloo new oxford english dictionary project |Waterloo New Oxford English Dictionary Project ,1.8852088701599685
cross-platform cat computer assisted translation tool |cross-platform CAT Computer Assisted Translation tool ,1.8682184264383768
character |Characters |characters |character ,1.8672508110938943
proprietary yes standalone yes no no |Proprietary Yes Standalone Yes No No ,1.8573365111219213
office open xml |Office Open XML ,1.8516979277452783
army missile command iads hypertext system |Army Missile Command IADS hypertext system ,1.8495661813536375
mac os x neooffice patrick luby |Mac OS X NeoOffice Patrick Luby ,1.844278024495997
office open |Office Open ,1.8417227175296869
ibm wp zos doc wpf dc |ibm wp zos doc wpf dcs ,1.834202953419874
extended reference concrete syntax ercs project |Extended Reference Concrete Syntax ERCS project ,1.8287646121288426
supports office open xml text document |supports Office Open XML text documents ,1.8261491123975027
mac os x-based neooffice office suite |Mac OS X-based NeoOffice office suite ,1.8204943546891492
www aspose com community blogs aspose |www aspose com community blogs aspose ,1.8182001788075088
supports office open xml spreadsheet document |supports Office Open XML spreadsheet documents ,1.8174527983767093
import only office open xml support |import only Office Open XML support ,1.813690127965467
supports office open xml presentation document |supports Office Open XML presentation documents ,1.812801429253461
generalized markup applications slim structured language |Generalized Markup Applications SLIM Structured Language ,1.8095257776157596
office open xml packages and subpackage |Office Open XML packages and subpackages ,1.8078947288576854
leading microsoft excel compatible spreadsheet component |leading Microsoft Excel compatible spreadsheet component ,1.8053488718975894
microsoft |Microsoft ,1.8027855211325923
office open xml word processing file |Office Open XML word processing files ,1.8026460432543845
apple pro tips editing word file |Apple Pro Tips Editing Word Files ,1.802394939931733
iso dsdl document schema description language |ISO DSDL Document Schema Description Languages ,1.8010890348248307
highly structured and relatively unstructured content |highly structured and relatively unstructured content ,1.8003204281453788
interest group mailing list and issue |Interest Group mailing list and issues ,1.8002803580759834
infoset augmentation facility and attribute default |infoset augmentation facility and attribute defaults ,1.8002215025582535
fixed delimiter set and adopts unicode |fixed delimiter set and adopts Unicode ,1.8001735663941218
well-formedness and error-handling edit main article |Well-formedness and error-handling edit Main article ,1.7996369602571654
gpl yes incomplete support go-oo calc |GPL Yes Incomplete support Go-oo Calc ,1.799122344209866
web-based word processor and spreadsheet application |web-based word processor and spreadsheet application ,1.7989994832771707
reading writing and converting xlsx file |reading writing and converting XLSX files ,1.798981129630254
office suite opendocument format references edit |Office suite OpenDocument Format References edit ,1.7988196205861668
extensible markup language xml current status |Extensible Markup Language XML Current status ,1.7983583258312048
reading and writing excel xml document |reading and writing Excel XML documents ,1.7971867315937649
xml information set or xml infoset |XML Information Set or XML infoset ,1.7970872309629244
office open xml text import filter |Office Open XML text import filter ,1.7970075566590094
biztalk server supports office open xml |BizTalk Server Supports Office Open XML ,1.7969400164540716
office open xml spreadsheet data format |Office Open XML spreadsheet data format ,1.796931596600424
office open xml presentation file format |Office Open XML presentation file formats ,1.796844974644996
office open xml spreadsheet file format |Office Open XML spreadsheet file formats ,1.7968340535277398
document |document |documents |Documents ,1.7931253320326948
window |Windows ,1.7646850814552173
batchpurifier batch metadata removal tool |BatchPurifier batch metadata removal tool ,1.6760614821009832
click indentation collapse child fold |click indentation Collapse child fold ,1.645459788663714
markup |markup |Markup ,1.609559958322485
docbook xsl xslt transformation suite |DocBook XSL XSLT transformation suite ,1.5801699943955452
office open xml file format |Office Open XML File Formats |Office Open XML file formats ,1.5774614617364233
publishing entire dita document structure |publishing entire DITA document structure ,1.574092108092763
xslt xquery debugger and profiler |XSLT XQuery debugger and profiler ,1.5730937161715586
nrl and nvdl routing language |NRL and NVDL routing languages ,1.5729983637140807
oxygen xml editor styled oxygen |Oxygen XML Editor styled oXygen ,1.5725731266691887
office open xml text document |Office Open XML text documents ,1.5621911735218408
open xml |Open XML ,1.5610121630277265
format |format |formats ,1.5603753334859274
sun microsystems engineer jon bosak |Sun Microsystems engineer Jon Bosak ,1.5566665410990799
docx |Docx |DOCX |docx ,1.539593602733044
unicode |Unicode ,1.534843526199666
native python module allowing creation |native Python module allowing creation ,1.5310933667287139
potentially dated statements commons category |potentially dated statements Commons category ,1.5310933667287139
element |element |elements ,1.5260770344853976
proprietary yes standalone yes no |Proprietary Yes Standalone Yes No ,1.5232039603010736
office open xml spreadsheet document |Office Open XML spreadsheet documents ,1.5172741729385661
unix timeline usage share feature |Unix Timeline Usage share Features ,1.5160388882353482
translation |Translation |translation ,1.512669589967742
open source command line utility |open source command line utility ,1.5125908983472007
ooxml openxml or msooxml document |OOXML OpenXML or MSOOXML documents ,1.5015131593586364
office open xml presentation document |Office Open XML presentation documents ,1.4999220275506775
translation support edit omegat omegat |Translation support edit OmegaT OmegaT ,1.498930699906226
balinese cham or phoenician script |Balinese Cham or Phoenician scripts ,1.4922426915580196
viewers filters and converters edit |Viewers filters and converters edit ,1.4888660635459159
current iso iec standardization process |current ISO IEC standardization process ,1.4882001788075092
comma or semi-colon delimited list |comma or semi-colon delimited list ,1.48575281973693
css class or identifier name |CSS class or identifier names ,1.48575281973693
perl based command line utility |perl based command line utility ,1.4847173985916848
ocr and document conversion software |OCR and Document Conversion Software ,1.4846633759408883
mgml minimal generalized markup language |MGML Minimal Generalized Markup Language ,1.483782994143537
xlsx |XLSX |xlsx ,1.4829518362559237
world wide web consortium type |World Wide Web Consortium Type ,1.4801530518635246
excel c vb net component |Excel C VB NET component ,1.480039943766944
windows wordperfect office corel proprietary |Windows WordPerfect Office Corel Proprietary ,1.47956740284334
windows kingsoft office kingsoft proprietary |Windows Kingsoft Office Kingsoft Proprietary ,1.479440172084728
adobe buzzword online word processor |Adobe Buzzword online word processor ,1.478854925132308
microsoft office open xml converter |Microsoft Office Open XML Converter ,1.477785361691302
b c d e f |b c d e f ,1.4776503979595754
risp lisp sgml text processor |RISP LISP SGML text processor ,1.4775726597566499
note edit spring tools suite |NOTE edit Spring Tools Suite ,1.4763266082158084
c c library framework sdk |C C library framework sdk ,1.4762343410659986
evermore software eioffice word processor |Evermore Software EIOffice Word Processor ,1.4748770245654281
valid characters edit main article |Valid characters edit Main article ,1.4748307966886998
microsoft excel compatible spreadsheet component |Microsoft Excel Compatible Spreadsheet Component ,1.473753514820159
b c free online converter |b c free online converter ,1.4736122836578227
world wide web consortium |World Wide Web Consortium ,1.4729741627364417
vice versa openxml document viewer |vice versa OpenXML Document Viewer ,1.4724032828285918
data serialization formats notes edit |data serialization formats Notes edit ,1.4721037567592423
mac os x standalone apple |Mac OS X Standalone Apple ,1.4712910671921844
open source wordprocessor gpl license |open source wordprocessor GPL license ,1.470637218520781
open source library apache license |open source library Apache license ,1.4705029563219416
b c omegat document filter |b c OmegaT Document Filters ,1.4702137659120877
gnu lgpl yes eclipse plugin |GNU LGPL Yes Eclipse Plugin ,1.4699930466472035
gpl yes adobe buzzword beta |GPL Yes Adobe Buzzword beta ,1.4699308580262553
u fffe and u ffff |U FFFE and U FFFF ,1.469510608230731
simpler definition and validation framework |simpler definition and validation framework ,1.4694248600225122
sun solutions proprietary yes bean |Sun Solutions Proprietary Yes Bean ,1.4694049898958772
definition text-based itu-t and iso |definition text-based ITU-T and ISO ,1.4694010403763589
proprietary old version open source |Proprietary old version open source ,1.4693892403774704
logical and physical structures element |logical and physical structures elements ,1.469338934281771
proprietary yes standalone eclipse plugin |Proprietary Yes Standalone Eclipse Plugin ,1.4691502743417035
chinese armenian and cyrillic character |Chinese Armenian and Cyrillic characters ,1.4691468308033764
populating xlsx and docx format |populating xlsx and docx formats ,1.4684689414758354
document generation and reporting toolkit |document generation and reporting toolkit ,1.468328982798334
developers support reading and writing |developers support reading and writing ,1.4683005837840293
xml binary characterization working group |XML Binary Characterization Working Group ,1.4681760204777594
xml com publicly available software |xml com Publicly Available Software ,1.4677854894174318
microsoft excel xml spreadsheet document |Microsoft Excel XML spreadsheet documents ,1.467222970802371
open and free document file |open and free document file ,1.4671068889519927
xml document and programming-language object |XML document and programming-language objects ,1.46693891602296
xml extensible markup language xml |XML Extensible Markup Language XML ,1.4668365126525091
office open xml software v |Office Open XML software v ,1.4668270182686782
office open xml wordprocessingml format |Office Open XML WordprocessingML format ,1.4667705453798927
office open xml presentation format |Office Open XML presentation format ,1.4667505521330864
office open xml wordprocessing file |Office Open XML wordprocessing files ,1.4667467828824412
office open xml wordprocessingml file |Office Open XML WordprocessingML files ,1.466743037465186
extenxls office open xml support |ExtenXLS Office Open XML Support ,1.4667199752848346
limited office open xml support |limited Office Open XML support ,1.4667103649458353
office open xml text format |Office Open XML text format ,1.4667078993621578
access office open xml document |Access Office Open XML documents ,1.4667050944858848
office open xml word document |Office Open XML Word documents ,1.4666581407912331
microsoft office office open xml |Microsoft Office Office Open XML ,1.466522087302228
command line utility |command line utility ,1.4532334773711812
schema |schema |schemas |Schema |Schemas ,1.4396467880686643
madcap flare overview authoring |MadCap Flare Overview Authoring ,1.4305763246895897
attribute |Attributes |attribute |attributes ,1.4227211088629397
openoffice |OpenOffice ,1.413878559843976
application |application |applications |Applications ,1.3999638522885642
apple |Apple ,1.3892602899971815
example |Examples |example |examples ,1.3873782641610783
linux |Linux ,1.384222309352213
ibm |IBM |ibm |Ibm ,1.3833669624243
sgml |SGML ,1.3801837543543347
mikemaccana python-docx git hub |mikemaccana python-docx Git Hub ,1.3752300611939567
editing |editing |Editing ,1.3691036151956408
internet |Internet ,1.3678976797480833
openoffice org |OpenOffice org ,1.3466147149114587
encoding |encodings |encoding |Encodings ,1.3176686737030283
potentially dated statement |potentially dated statements ,1.313847481906498
internet engineering task force |Internet Engineering Task Force ,1.3104049605611767
opening |opening ,1.303495354124126
dtds |DTDs ,1.303495354124126
built-in quick preview feature |built-in quick preview feature ,1.3034668067574706
use |use ,1.3007000963934179
vice versa |vice versa ,1.2998405226427647
office open xml file |Office Open XML files ,1.293188597276251
oxygen |Oxygen |oXygen ,1.287125323881713
openxml od f translator |OpenXML OD F Translator ,1.2742286148837931
office open xml text |Office Open XML text ,1.2672939775349676
editor |editor |Editor |editors ,1.2659770048933574
b c documents togo |b c Documents ToGo ,1.258655308099784
open xml file format |Open XML file formats ,1.2572302996492244
promotional tone wikipedia article |promotional tone Wikipedia articles ,1.2558827539465558
washington university law review |Washington University Law Review ,1.2550911244117415
altova |Altova ,1.2526056040917832
standard global transform scenario |standard global transform scenarios ,1.2520594242679317
uml zend studio retrieved |UML Zend Studio Retrieved ,1.2449976310182789
basic syntax highlighting support |basic syntax highlighting support ,1.243672230444331
true wysiwyg and editing |true WYSIWYG and editing ,1.242835330409872
comments and processing instruction |comments and processing instructions ,1.2428000003790223
validation and transformation service |validation and transformation services ,1.2427817395427463
oxygen xml project workspace |Oxygen XML project workspace ,1.2424739667639753
editing document-like xml file |editing document-like XML files ,1.2423466947074537
specialized xml formats edit |specialized XML formats edit ,1.2423317120476354
general xml document editing |general XML document editing ,1.2423132617512798
writer |Writer ,1.2410924367195972
allowable parent child relationship |allowable parent child relationships ,1.2386043634452464
oracle bi publisher p |Oracle BI Publisher P ,1.2386043634452464
text |texts |text ,1.2359391919857687
first desktop ocr application |first desktop OCR application ,1.2353963742036314
sdk |SDK ,1.227169981977766
graphical stylesheet design tool |graphical stylesheet design tool |Graphical Stylesheet Design Tool ,1.227169383675696
novell |Novell ,1.2239900054710868
utility |utility ,1.2200353738284253
extended reference concrete syntax |Extended Reference Concrete Syntax ,1.2176085403847963
early digital media publisher |early digital media publishers ,1.2102677430340827
dom traversal api nodeiterator |DOM traversal API NodeIterator ,1.2067103318136334
windows ce |Windows CE ,1.2046425085262493
xslt |xslt |XSLT |XSLTs ,1.20450344141799
office open xml format |Office Open XML formats |Office Open XML format ,1.2026121601908426
extensible markup language xml |Extensible Markup Language XML ,1.2002206561662507
office open xml document |Office Open XML documents ,1.1995395274123613
wordprocessingml |WordprocessingML ,1.1927464614178325
feature |features |feature |Features ,1.1902586821668701
command line |command line ,1.1893970555247255
viewers filters and converter |Viewers filters and converters ,1.1891020135157548
resource description framework rdf |Resource Description Framework RDF ,1.1879871148639012
zip archive file pair |ZIP archive file pairs ,1.1835583760276138
no partial dita map |No Partial DITA Map ,1.1792655751035834
angle bracket tax |Angle Bracket Tax ,1.1790902855518084
video game console |video game console ,1.1790902855518084
kikaku itscj ipsj |kikaku itscj ipsj ,1.1790902855518084
nxml-mode current gnu gpl |nxml-mode current GNU GPL ,1.1776497894494014
online file conversion service |online file conversion service ,1.1770423047882799
java |Java ,1.1743280851779727
spreadsheet and presentation document |spreadsheet and presentation documents ,1.173367364128504
language |languages |language ,1.1733579862752277
interest group mailing list |Interest Group mailing list ,1.170308914674154
report mining tool monarch |report mining tool Monarch ,1.1699095260848495
b c brian jones |b c Brian Jones ,1.1690268851159853
document type definition dtd |Document Type Definition DTD ,1.1681267702680724
ibm websphere business modeler |IBM WebSphere Business Modeler ,1.1676935635893528
office open xml support |Office Open XML Support |Office Open XML support ,1.1658963675595586
former binary file format |former binary file formats ,1.1656452263149217
dead external links article |dead external links Articles ,1.164021397168244
open xml format sdk |Open XML Format SDK ,1.1637454653341885
cross-platform standalone plutext pty |Cross-platform Standalone Plutext Pty ,1.1622426915580195
excel |Excel ,1.1603852813497009
windows standalone openxml biz |Windows Standalone OpenXML biz ,1.160258185298678
uof and vice versa |UOF and vice versa ,1.1591616842242105
corel eula yes import |Corel EULA Yes Import ,1.1590048551824883
internal and external relationship |internal and external relationships ,1.158927476976881
ja use mdy date |ja Use mdy dates ,1.1587266455843197
parsing |parsing ,1.1583439107878197
validating or non-validating depending |validating or non-validating depending ,1.1572159148334717
standard public entity set |standard public entity sets ,1.1567551955264757
butler office pro x |Butler Office Pro X ,1.1567520823710185
rich text format rtf |Rich Text Format RTF ,1.1565996286300595
question marks or box |question marks or boxes ,1.156458788699597
unified office format uof |Unified Office Format UOF ,1.1557968079492844
interface-oriented application programming interface |interface-oriented application programming interface ,1.15575281973693
native winds docx converter |Native Winds Docx Converter ,1.1550929925365288
open xml package explorer |Open XML Package Explorer ,1.1550426023300244
websphere business modeler |WebSphere Business Modeler ,1.1543371981154584
dataviz |DataViz |Dataviz ,1.1539564327727696
mac os x standalone |Mac OS X Standalone ,1.15372360762467
then-new world wide web |then-new World Wide Web ,1.152637681262807
character repertoire constraints renaming |character repertoire constraints renaming ,1.152163359766747
start-tag or empty-element tag |start-tag or empty-element tag ,1.151627835497002
office open xml spreadsheet |Office Open XML spreadsheets ,1.1515326138659
specifically excluded control character |specifically excluded control characters ,1.151125781494116
edit integrated development environment |edit Integrated development environment ,1.1505032345305375
uti conformation public text |UTI conformation public text ,1.1501388167957598
software development consulting service |Software Development Consulting Services ,1.1497243132111785
iso iec international standard |ISO IEC International Standard ,1.14952577761576
example data binding system |Example data binding systems ,1.14952577761576
aspose words product family |Aspose Words product family ,1.1493964843730644
hexadecimal numeric character reference |hexadecimal numeric character references ,1.149022582292837
mac and microsoft office |Mac and Microsoft Office ,1.1488668625733467
india news software iso |India News Software ISO ,1.1487260960618197
error-handling edit main article |error-handling edit Main article ,1.1485543918619436
quark author web edition |Quark Author Web Edition ,1.1483323015293403
b http www neowin |b http www neowin ,1.147709365230575
evermore software eioffice presentation |Evermore Software EIOffice Presentation ,1.147563012726648
syntax and processing rule |syntax and processing rules ,1.1474694497454931
